[
  {
    "id": "mosip",
    "name": "MOSIP",
    "type": "Open DPG",
    "layer": "Identity",
    "repository": "https://github.com/mosip",
    "summary": "Modular open-source foundational identity platform for enrollment, identity repository, authentication, and integrations.",
    "useCaseFit": ["identity verification", "beneficiary onboarding", "credential checks"],
    "standards": ["OpenID Connect", "biometric standards", "API integration"],
    "maturity": "Established",
    "implementationNotes": ["Validate legal mandate and data-protection basis", "Design exception paths for people not yet covered"]
  },
  {
    "id": "opencrvs",
    "name": "OpenCRVS",
    "type": "Open DPG",
    "layer": "Civil registration",
    "repository": "https://github.com/opencrvs",
    "summary": "Civil registration platform for births, deaths, and vital events.",
    "useCaseFit": ["legal identity", "birth registration", "vital statistics"],
    "standards": ["civil registration workflows", "API integration"],
    "maturity": "Established",
    "implementationNotes": ["Confirm CRVS authority ownership", "Use minimal validation tokens where possible"]
  },
  {
    "id": "mojaloop",
    "name": "Mojaloop",
    "type": "Open DPG",
    "layer": "Payments",
    "repository": "https://github.com/mojaloop",
    "summary": "Open-source reference model and software for interoperable inclusive instant payment systems.",
    "useCaseFit": ["cash transfers", "merchant payments", "low-cost payment rails"],
    "standards": ["ISO 20022 alignment", "interoperable payment APIs"],
    "maturity": "Established",
    "implementationNotes": ["Test settlement, reversals, failed payments, fees, and reconciliation", "Map the actual national payment operators"]
  },
  {
    "id": "xroad",
    "name": "X-Road",
    "type": "Open-source tool",
    "layer": "Data exchange",
    "repository": "https://github.com/nordic-institute/X-Road",
    "summary": "Secure data exchange layer for approved organizations to exchange signed, logged messages.",
    "useCaseFit": ["agency-to-agency exchange", "audit logs", "trusted service queries"],
    "standards": ["signed messages", "service registry", "audit logging"],
    "maturity": "Established",
    "implementationNotes": ["Define agency onboarding rules", "Publish service contracts and audit responsibilities"]
  },
  {
    "id": "apisix",
    "name": "Apache APISIX",
    "type": "Open-source tool",
    "layer": "Data exchange",
    "repository": "https://github.com/apache/apisix",
    "summary": "Open-source API gateway for routing, authentication, observability, and policy controls across services.",
    "useCaseFit": ["API gateway", "service orchestration", "data exchange"],
    "standards": ["OpenAPI", "API gateway policies", "access logging"],
    "maturity": "Established",
    "implementationNotes": ["Pair API routing with clear data-sharing agreements", "Log every service-to-service request"]
  },
  {
    "id": "openg2p",
    "name": "OpenG2P",
    "type": "Open DPG",
    "layer": "Social protection",
    "repository": "https://github.com/openg2p",
    "summary": "Open platform for registries, eligibility, enrollment, and government-to-person benefit delivery.",
    "useCaseFit": ["cash transfers", "social registry", "benefit delivery"],
    "standards": ["registry APIs", "payment integration", "eligibility rules"],
    "maturity": "Growing",
    "implementationNotes": ["Validate targeting and grievance processes", "Integrate with the payment rail people can actually access"]
  },
  {
    "id": "openspp",
    "name": "OpenSPP",
    "type": "Open-source tool",
    "layer": "Registries",
    "repository": "https://github.com/OpenSPP",
    "summary": "Modular social protection platform with registries and programme operations, including farmer registry patterns.",
    "useCaseFit": ["farmer support", "social protection", "programme registries"],
    "standards": ["Odoo modules", "registry workflows", "API integration"],
    "maturity": "Growing",
    "implementationNotes": ["Check whether an existing registry can be cleaned before creating a new one", "Design consent, correction, and deduplication workflows"]
  },
  {
    "id": "dhis2",
    "name": "DHIS2",
    "type": "Open DPG",
    "layer": "Health",
    "repository": "https://github.com/dhis2",
    "summary": "Health information system used for reporting, analytics, public health programmes, and facility data.",
    "useCaseFit": ["health access", "public health reporting", "programme dashboards"],
    "standards": ["FHIR integrations", "aggregate reporting", "data dictionaries"],
    "maturity": "Established",
    "implementationNotes": ["Separate patient-level records from aggregate reporting", "Use standard data dictionaries across programmes"]
  },
  {
    "id": "openmrs",
    "name": "OpenMRS",
    "type": "Open DPG",
    "layer": "Health",
    "repository": "https://github.com/openmrs",
    "summary": "Open-source electronic medical record system for patient-level care.",
    "useCaseFit": ["patient records", "referrals", "facility workflows"],
    "standards": ["FHIR", "OpenHIE patterns"],
    "maturity": "Established",
    "implementationNotes": ["Protect patient privacy by default", "Define facility workflows before integrations"]
  },
  {
    "id": "openfn",
    "name": "OpenFn",
    "type": "Open-source tool",
    "layer": "Operations",
    "repository": "https://github.com/OpenFn",
    "summary": "Workflow and integration platform for connecting systems and automating public-sector processes.",
    "useCaseFit": ["system integration", "workflow automation", "data movement"],
    "standards": ["workflow definitions", "connectors", "API integration"],
    "maturity": "Specialized",
    "implementationNotes": ["Treat workflows as auditable public-sector operations", "Document every connector and transformation"]
  },
  {
    "id": "openfisca",
    "name": "OpenFisca",
    "type": "Open-source tool",
    "layer": "Operations",
    "repository": "https://github.com/openfisca/openfisca-core",
    "summary": "Rules-as-code engine for tax, benefits, eligibility, and policy simulation.",
    "useCaseFit": ["eligibility rules", "subsidies", "benefit policy simulation"],
    "standards": ["rules-as-code", "policy modeling"],
    "maturity": "Established",
    "implementationNotes": ["Make eligibility logic testable and reviewable", "Keep policy rules separate from user records"]
  },
  {
    "id": "odk",
    "name": "ODK",
    "type": "Open-source tool",
    "layer": "Service delivery",
    "repository": "https://github.com/getodk",
    "summary": "Open-source field data collection tools for offline surveys and programme operations.",
    "useCaseFit": ["field enrollment", "offline verification", "monitoring"],
    "standards": ["XForms", "offline data collection"],
    "maturity": "Established",
    "implementationNotes": ["Use when field collection is required before a national service exists", "Plan data cleanup and consent before scale"]
  },
  {
    "id": "ocds",
    "name": "Open Contracting",
    "type": "Open standard and tooling",
    "layer": "Operations",
    "repository": "https://github.com/open-contracting",
    "summary": "Open Contracting Data Standard and tools for publishing and analyzing procurement data.",
    "useCaseFit": ["procurement transparency", "supplier participation", "public spending"],
    "standards": ["OCDS"],
    "maturity": "Established",
    "implementationNotes": ["Align procurement events to OCDS where possible", "Protect sensitive supplier and payment details"]
  }
]
